{
  "gates": [
    "cargo_check",
    "cargo_test"
  ],
  "id": "df06-context-build",
  "is_archived": true,
  "is_held": false,
  "last_event_seq": 9,
  "objective": "Wire context build to produce file hashes in read_scope",
  "phase": "completed",
  "read_scope": [
    "src/application/mod.rs",
    "src/cli/mod.rs"
  ],
  "risk_triggers": [],
  "schema": "control.task-view.v1",
  "write_allow": [
    "src/application/mod.rs",
    "src/cli/mod.rs"
  ],
  "write_deny": []
}