{
  "gates": [
    "cargo_check",
    "cargo_test"
  ],
  "id": "df07-audit-output",
  "is_archived": true,
  "is_held": false,
  "last_event_seq": 9,
  "objective": "Verify audit command outputs gate results and evidence summary",
  "phase": "completed",
  "read_scope": [
    "src/application/mod.rs",
    "src/cli/mod.rs"
  ],
  "risk_triggers": [],
  "schema": "control.task-view.v1",
  "write_allow": [
    "src/cli/mod.rs"
  ],
  "write_deny": []
}