{
  "gates": [
    "cargo_check",
    "cargo_clippy"
  ],
  "id": "df01-clippy-docs",
  "is_archived": false,
  "is_held": false,
  "last_event_seq": 4,
  "objective": "Remove dead-code warnings in application/mod.rs (collect_files_recursive, UNVERIFIED hash)",
  "phase": "cancelled",
  "read_scope": [
    "src/application/mod.rs"
  ],
  "risk_triggers": [],
  "schema": "control.task-view.v1",
  "write_allow": [
    "src/application/mod.rs"
  ],
  "write_deny": []
}