{
  "gates": [
    "cargo_check",
    "cargo_test"
  ],
  "id": "df02-assignment-fields",
  "is_archived": true,
  "is_held": false,
  "last_event_seq": 9,
  "objective": "Add context_hashes, required_capabilities, acceptance, and contract fields to assignment export",
  "phase": "completed",
  "read_scope": [
    "src/application/mod.rs"
  ],
  "risk_triggers": [],
  "schema": "control.task-view.v1",
  "write_allow": [
    "src/application/mod.rs"
  ],
  "write_deny": []
}