{
  "gates": [
    "cargo_check",
    "cargo_test"
  ],
  "id": "df10-replay-determinism",
  "is_archived": true,
  "is_held": false,
  "last_event_seq": 9,
  "objective": "Verify replay determinism: delete all task.json and rebuild from events.jsonl",
  "phase": "completed",
  "read_scope": [
    "src/infrastructure/store"
  ],
  "risk_triggers": [],
  "schema": "control.task-view.v1",
  "write_allow": [
    "src/infrastructure/store/mod.rs"
  ],
  "write_deny": []
}