{
  "gates": [
    "cargo_check",
    "cargo_test"
  ],
  "id": "df04-status-json",
  "is_archived": true,
  "is_held": false,
  "last_event_seq": 11,
  "objective": "Add --json flag to task status command for machine-readable output",
  "phase": "completed",
  "read_scope": [
    "src/cli/mod.rs"
  ],
  "risk_triggers": [],
  "schema": "control.task-view.v1",
  "write_allow": [
    "src/cli/mod.rs"
  ],
  "write_deny": []
}