{
  "gates": [
    "cargo_check",
    "cargo_test"
  ],
  "id": "df08-doctor-checks",
  "is_archived": true,
  "is_held": false,
  "last_event_seq": 9,
  "objective": "Verify doctor command checks M3 ledger health",
  "phase": "completed",
  "read_scope": [
    "src/application/mod.rs"
  ],
  "risk_triggers": [],
  "schema": "control.task-view.v1",
  "write_allow": [
    "src/application/mod.rs"
  ],
  "write_deny": []
}