{
  "gates": [
    "cargo_check",
    "cargo_test"
  ],
  "id": "df09-gate-runner-fix",
  "is_archived": true,
  "is_held": false,
  "last_event_seq": 9,
  "objective": "Fix gate runner env allowlist for Windows MSVC linker",
  "phase": "completed",
  "read_scope": [
    "src/infrastructure/gates/mod.rs"
  ],
  "risk_triggers": [],
  "schema": "control.task-view.v1",
  "write_allow": [
    "src/infrastructure/gates/mod.rs"
  ],
  "write_deny": []
}